"x,","y,","y,",Múzeá a galérie,Číslo,Info
18.89279,48.45972,0,Slovenské banské múzeum - Berggericht,1,"celok dvoch meštianskych domov z 15. storočia postavených v neskorogotickorenesančnom slohu, ktoré boli v 16. storočí zlúčené a prestavavé. V rokoch 1792 až 1854 sa v budove usídli Dištriktuálny banský súd (odtiaľ pomenovanie objektu). Neskôr v ňom sídlil Banský kapitanát a do roku 1900 využívala objekt Banícka akadémia. Dnes je v ňom mineralogická expozícia Slovenského banského múzea "
18.890951,48.45918,0,Slovenské banské múzeum - Starý zámok,2,"zachovalý hradný komplex (tiež Mestský hrad) vznikol ako renesančná protiturecká pevnosť z románsko-gotického kostola Panny Márie na začiatku 13. storočia, ktorý bol v rokoch 1495 až 1515 prebudovaný a opevnený. V 60-tych rokoch 16. storočia boli vykonané ďalšie úpravy a posledné výraznejšie práce na obrannom komplexe boli vykonané v roku 1777. Základ komplexu tvorí trojloďová gotická bazilika, ktorú dopĺňa kaplnka svätého Michala. V 19. storočí pôvodná funkcia pevnosti pominula a slúžila pre rôzne účely. Od roku 1900 je komplex mestským múzeom"
18.896203,48.457896,0,Slovenské banské múzeum - Kammerhof,3,"najväčší stavebný komplex na území mesta (tiež Komorský dvor). Bol vybudovaný v polovici 16. storočia prestavbou viacerých meštianskych domov. Vzácna je bývalá jezuitská kaplnka s renesančným portálom, v zadnej časti budovy stoja dve renesančné bašty. Objekt bol sídlom banskej komory a hlavného komorsko-grófskeho úradu. Dnes je sídlom riaditeľstva Slovenského banského múzea a expozície baníctva a baníckeho školstva na Slovensku"
18.896144,48.455776,0,Slovenské banské múzeum - Nový zámok,4,
18.888527,48.451348,0,Slovenské banské múzeum - Banské múzeum v prírode,5,"najstaršia a tematicky najrozsiahlejšia banícka expozícia na Slovensku sprístupnená od roku 1974 s vývojom rudného baníctva v stredoeurópskom priestore od stredoveku do konca 20. storočia. V podzemnej expozícii štôlne Bartolomej je gápel na konský pohon, v povrchovej expozícii je Kachelmanov vodnostĺpcový ťažný stroj premiestnený zo šachty Lill, banské budovy rôznych závodov na Slovensku a geologická náučná expozícia"
18.891853,48.458116,0,Galéria Schemnitz,6,
18.942861,48.421703,0,Múzeum vo Svätom Antone,7,
18.82862,48.46433,0,Podzemná expozícia Stará baňa všetkých svätých - štôlňa Prostredná,8,
